{
  "policy_version": "2026.24.0",
  "governance_contract_changelog": "docs/GOVERNANCE_CONTRACT_CHANGELOG.md",
  "authority_model": {
    "MACHINE_VERIFIED": "Deterministic hard gate; non-zero exit blocks merge.",
    "MACHINE_ASSISTED": "Machine-checked hygiene model that improves review quality but is not correctness proof alone.",
    "HUMAN_REVIEW_ONLY": "Human constitutional judgment; cannot be fully automated."
  },
  "failure_mode_vocabulary": {
    "FM_MANIFEST_DRIFT": "Repository tree drifts from MANIFEST hashes.",
    "FM_SCHEMA_REGRESSION": "Schema acceptance/rejection semantics regress.",
    "FM_NONDETERMINISTIC_HASH": "Canonical hashing output becomes unstable.",
    "FM_RUNNER_EXECUTION_DRIFT": "Worked example execution path regresses.",
    "FM_FAIL_CLOSED_REGRESSION": "Missing evidence fails to fail-closed.",
    "FM_GATE_ID_DRIFT": "Gate IDs drift from canonical contract.",
    "FM_BENCHMARK_OVERCLAIM": "Benchmark claims exceed demo-only reality.",
    "FM_ENTRYPOINT_BREAKAGE": "Core tool entrypoints no longer invoke.",
    "FM_SYNTAX_BREAKAGE": "Syntax/import breakage in tools/benchmark scripts.",
    "FM_INTERNAL_LINK_BREAKAGE": "Internal links/anchors resolve incorrectly.",
    "FM_EXTERNAL_LINK_BREAKAGE": "External reachability indicates broken public references.",
    "FM_PAGES_SURFACE_BREAKAGE": "Published HTML surface is structurally broken.",
    "FM_ARTIFACT_PROVENANCE_DRIFT": "CI evidence artifacts lack canonical names/checksums/provenance.",
    "FM_DOCTRINE_DRIFT": "Governance doctrine drifts from policy constraints.",
    "FM_POLICY_DOC_DRIFT": "Checklist/docs diverge from canonical governance contract.",
    "FM_GOVERNANCE_REGRESSION": "Validator behavior drifts without regression guardrails.",
    "FM_DEPENDENCY_HERMETICITY": "Dependency policy is non-deterministic or lockfile drifts.",
    "FM_UNDECLARED_DEPENDENCY": "Governance tools import undeclared hidden dependencies.",
    "FM_CLI_CONTRACT_DRIFT": "Governance-critical CLI entrypoints drift from expected contract.",
    "FM_REQUIRED_CHECK_MAPPING_DRIFT": "Required-check to workflow-job mapping drifts from canonical immutable contract.",
    "FM_GITHUB_SETTINGS_BASELINE_DRIFT": "Declared external GitHub settings baseline drifts from enforced governance contract.",
    "FM_POST_MERGE_OPS_DRIFT": "Post-merge GitHub operations drift from repository governance assumptions.",
    "FM_POLICY_DRIFT_REVIEW_MISSING": "Policy-drift review section is missing for governance-critical changes.",
    "FM_WORKFLOW_PRIVILEGE_ESCALATION": "Workflow permissions/triggers/escalation surfaces violate trust model.",
    "FM_MANIFEST_INVENTORY_UNTRUTHFUL": "MANIFEST inventory is incomplete, manipulated, or includes forbidden artifacts.",
    "FM_REPO_MAP_UNTRUTHFUL": "repo-map inventory is incomplete, stale, or unauthorized.",
    "FM_CODEOWNERS_DILUTION": "CODEOWNERS rules are diluted by broad later patterns.",
    "FM_PR_TEMPLATE_WEAKENING": "PR template structure/content quality is weakened or placeholder-only.",
    "FM_LOCAL_BASELINE_DRIFT": "Canonical local baseline parity drifts from CI/checklist surfaces.",
    "FM_GOVERNANCE_ARTIFACT_NONDETERMINISM": "Tracked governance artifacts are generated nondeterministically.",
    "FM_ONE_PR_DOCTRINE_WEAKENING": "Auto-generated PR mechanisms or maintenance bots can bypass one-PR doctrine.",
    "FM_JOB_WEAKENING": "Critical CI jobs are silently weakened (strictness, retention, tolerating failures).",
    "FM_DOCUMENTATION_UNTRUTHFUL": "Governance docs claim enforcement beyond repo-native capability.",
    "FM_PR_INTAKE_QUALITY": "Pull request intake quality is empty/formal for mandatory governance sections.",
    "FM_EXECUTION_CHAIN_VERIFICATION_DRIFT": "Independent execution-chain recomputation no longer matches emitted chain claims.",
    "FM_GIT_AUTHORITY_EXECUTION_DRIFT": "Execution verification paths allow non-authoritative Git state or fallback."
  },
  "invariants": [
    {
      "invariant_id": "INV_MANIFEST_TREE_MATCH",
      "domain_class": "integrity",
      "verification_scope": "SHARED",
      "authority_class": "MACHINE_VERIFIED",
      "claim_class": "artifact_integrity_claim",
      "minimum_evidence_requirement": "Manifest integrity verification command exits successfully.",
      "enforcer": "python tools/verify_manifest.py MANIFEST.json .",
      "local_command_id": "manifest-integrity",
      "local_command": "python tools/verify_manifest.py MANIFEST.json .",
      "ci_job_id": "inv-manifest-integrity",
      "blocked_failure_mode_codes": [
        "FM_MANIFEST_DRIFT"
      ],
      "what_is_not_verified": [
        "Does not prove semantic quality."
      ]
    },
    {
      "invariant_id": "INV_VALID_CANONICAL_ARTIFACT_ACCEPTED",
      "domain_class": "validity",
      "verification_scope": "SHARED",
      "authority_class": "MACHINE_VERIFIED",
      "claim_class": "schema_validity_claim",
      "minimum_evidence_requirement": "Valid canonical artifact fixture is accepted.",
      "enforcer": "python tools/validate_json.py schemas/canonical-artifact.schema.json tests/fixtures/artifact.valid.json",
      "local_command_id": "schema-valid-acceptance",
      "local_command": "python tools/validate_json.py schemas/canonical-artifact.schema.json tests/fixtures/artifact.valid.json",
      "ci_job_id": "inv-schema-valid-acceptance",
      "blocked_failure_mode_codes": [
        "FM_SCHEMA_REGRESSION"
      ],
      "what_is_not_verified": [
        "Does not validate production payload diversity."
      ]
    },
    {
      "invariant_id": "INV_INVALID_CANONICAL_ARTIFACT_REJECTED",
      "domain_class": "validity",
      "verification_scope": "SHARED",
      "authority_class": "MACHINE_VERIFIED",
      "claim_class": "schema_validity_claim",
      "minimum_evidence_requirement": "Invalid canonical artifact fixture is rejected.",
      "enforcer": "python tools/validate_json.py schemas/canonical-artifact.schema.json tests/fixtures/artifact.invalid.missing-valid-fingerprint.json",
      "local_command_id": "schema-invalid-rejection",
      "local_command": "python tools/validate_json.py schemas/canonical-artifact.schema.json tests/fixtures/artifact.invalid.missing-valid-fingerprint.json",
      "ci_job_id": "inv-schema-invalid-rejection",
      "blocked_failure_mode_codes": [
        "FM_SCHEMA_REGRESSION"
      ],
      "what_is_not_verified": [
        "Does not validate production payload diversity."
      ]
    },
    {
      "invariant_id": "INV_VALID_EVALUATION_RESULT_ACCEPTED",
      "domain_class": "validity",
      "verification_scope": "SHARED",
      "authority_class": "MACHINE_VERIFIED",
      "claim_class": "schema_validity_claim",
      "minimum_evidence_requirement": "Valid evaluation-result fixture is accepted.",
      "enforcer": "python tools/validate_json.py schemas/evaluation-result.schema.json tests/fixtures/evaluation-result.valid.json",
      "local_command_id": "schema-valid-evaluation-acceptance",
      "local_command": "python tools/validate_json.py schemas/evaluation-result.schema.json tests/fixtures/evaluation-result.valid.json",
      "ci_job_id": "inv-schema-valid-acceptance",
      "blocked_failure_mode_codes": [
        "FM_SCHEMA_REGRESSION"
      ],
      "what_is_not_verified": [
        "Does not validate production payload diversity."
      ]
    },
    {
      "invariant_id": "INV_INVALID_EVALUATION_RESULT_REJECTED",
      "domain_class": "validity",
      "verification_scope": "SHARED",
      "authority_class": "MACHINE_VERIFIED",
      "claim_class": "schema_validity_claim",
      "minimum_evidence_requirement": "Invalid evaluation-result fixture is rejected.",
      "enforcer": "python tools/validate_json.py schemas/evaluation-result.schema.json tests/fixtures/evaluation-result.invalid.bad-gate.json",
      "local_command_id": "schema-invalid-evaluation-rejection",
      "local_command": "python tools/validate_json.py schemas/evaluation-result.schema.json tests/fixtures/evaluation-result.invalid.bad-gate.json",
      "ci_job_id": "inv-schema-invalid-rejection",
      "blocked_failure_mode_codes": [
        "FM_SCHEMA_REGRESSION"
      ],
      "what_is_not_verified": [
        "Does not validate production payload diversity."
      ]
    },
    {
      "invariant_id": "INV_DEPENDENCY_HERMETICITY_LOCKED",
      "domain_class": "integrity",
      "verification_scope": "SHARED",
      "authority_class": "MACHINE_VERIFIED",
      "claim_class": "artifact_integrity_claim",
      "minimum_evidence_requirement": "requirements.txt uses deterministic pinning and governance lockfile remains synchronized with declared/used dependencies.",
      "enforcer": "python tools/check_dependency_hermeticity.py",
      "local_command_id": "dependency-hermeticity",
      "local_command": "python tools/check_dependency_hermeticity.py",
      "ci_job_id": "inv-dependency-hermeticity",
      "blocked_failure_mode_codes": [
        "FM_DEPENDENCY_HERMETICITY",
        "FM_UNDECLARED_DEPENDENCY"
      ],
      "what_is_not_verified": [
        "Does not provide full transitive lock reproducibility across all operating systems."
      ]
    },
    {
      "invariant_id": "INV_CANONICAL_HASH_STABLE",
      "domain_class": "integrity",
      "verification_scope": "CI_ONLY",
      "authority_class": "MACHINE_VERIFIED",
      "claim_class": "artifact_integrity_claim",
      "minimum_evidence_requirement": "Representative canonical hash inputs remain stable across repeated runs and edge-case negatives pass.",
      "enforcer": "python tools/check_canonical_hash_stability.py --repeat 3 + python tools/check_canonicalization_negative_cases.py",
      "ci_job_id": "inv-canonical-hash-stability",
      "blocked_failure_mode_codes": [
        "FM_NONDETERMINISTIC_HASH"
      ],
      "what_is_not_verified": [
        "Does not prove artifact semantic correctness."
      ]
    },
    {
      "invariant_id": "INV_WORKED_EXAMPLE_EXECUTES",